{
  "message": "*Solo/Duo Queue Win Rates:*\nAJsBigBackClock - DIAMOND II (54.17% | 13W-11L)\nDC Nalphstein - BRONZE IV (47.66% | 153W-168L)\nDheAbyss - GOLD IV (53.62% | 111W-96L)\nDLR JOSH - BRONZE II (51.36% | 113W-107L)\nDr backshots MD - PLATINUM II (52.55% | 206W-186L)\nDrowsytroll - BRONZE IV (45.83% | 22W-26L)\nEndar - GOLD IV (50.68% | 259W-252L)\nFaultySwitch - SILVER II (55.14% | 102W-83L)\nggrandfatherr - SILVER IV (50.89% | 86W-83L)\nGodstime - IRON II (50.0% | 8W-8L)\nJjice222 - SILVER III (50.66% | 77W-75L)\nJueviol - IRON II (48.72% | 114W-120L)\nK3 Teedawt - IRON I (49.65% | 71W-72L)\nKhanedi  - SILVER IV (47.17% | 50W-56L)\nKingmaker - GOLD IV (41.86% | 36W-50L)\nKT PapaChibs - BRONZE III (50.0% | 12W-12L)\nKT PapaChiibs  - BRONZE II (49.59% | 60W-61L)\nLNK GuyNow - SILVER III (49.87% | 194W-195L)\nLord Loyesco - GOLD I (52.28% | 309W-282L)\nLustyKami - BRONZE III (43.48% | 10W-13L)\nmarvyiscool - BRONZE III (48.95% | 303W-316L)\nMenoGrande - SILVER III (49.35% | 76W-78L)\nMonteng - PLATINUM IV (50.98% | 235W-226L)\nnawtydog - SILVER II (49.21% | 93W-96L)\nNigerian King - GOLD III (62.65% | 52W-31L)\nNigerian Lotus - BRONZE III (53.01% | 44W-39L)\nNigerianFaker - PLATINUM IV (50.33% | 77W-76L)\nnovas3nsei - PLATINUM III (48.77% | 99W-104L)\nOTPStormbringer - GOLD IV (50.84% | 365W-353L)\nRahzzcal - SILVER II (48.57% | 187W-198L)\nrileybash - GOLD IV (57.89% | 22W-16L)\nSadme17 - GOLD IV (51.33% | 77W-73L)\nShegz - PLATINUM IV (43.11% | 72W-95L)\nSLY LOKi - SILVER IV (51.55% | 200W-188L)\nSRM Kanedi - BRONZE I (50.0% | 38W-38L)\nSRM Silverfangs - PLATINUM II (11.11% | 1W-8L)\nTE PrismoO - SILVER I (47.68% | 72W-79L)\nTE XxRuina - GOLD III (42.86% | 24W-32L)\nTheStarOfMorning - EMERALD I (45.16% | 28W-34L)\nTK friendly - GOLD III (51.8% | 245W-228L)\nTK HYDRA - BRONZE IV (48.75% | 214W-225L)\nTK NigerianPluto - GOLD IV (50.85% | 298W-288L)\nTK SavageMummy - GOLD I (51.18% | 411W-392L)\nVersatile - GOLD III (53.47% | 108W-94L)\nVillanelle - GOLD IV (53.33% | 120W-105L)\nZanbacto - GOLD IV (50.0% | 157W-157L)\n",
  "timestamp": "2025-07-27_14-01-44",
  "changes": [
    {
      "summ_id": "AJsBigBackClock",
      "tier": "DIAMOND",
      "rank": "II",
      "wins": 13,
      "losses": 11,
      "total_games": 24,
      "win_rate": 54.17
    },
    {
      "summ_id": "DC Nalphstein",
      "tier": "BRONZE",
      "rank": "IV",
      "wins": 153,
      "losses": 168,
      "total_games": 321,
      "win_rate": 47.66
    },
    {
      "summ_id": "DheAbyss",
      "tier": "GOLD",
      "rank": "IV",
      "wins": 111,
      "losses": 96,
      "total_games": 207,
      "win_rate": 53.62
    },
    {
      "summ_id": "DLR JOSH",
      "tier": "BRONZE",
      "rank": "II",
      "wins": 113,
      "losses": 107,
      "total_games": 220,
      "win_rate": 51.36
    },
    {
      "summ_id": "Dr backshots MD",
      "tier": "PLATINUM",
      "rank": "II",
      "wins": 206,
      "losses": 186,
      "total_games": 392,
      "win_rate": 52.55
    },
    {
      "summ_id": "Drowsytroll",
      "tier": "BRONZE",
      "rank": "IV",
      "wins": 22,
      "losses": 26,
      "total_games": 48,
      "win_rate": 45.83
    },
    {
      "summ_id": "Endar",
      "tier": "GOLD",
      "rank": "IV",
      "wins": 259,
      "losses": 252,
      "total_games": 511,
      "win_rate": 50.68
    },
    {
      "summ_id": "FaultySwitch",
      "tier": "SILVER",
      "rank": "II",
      "wins": 102,
      "losses": 83,
      "total_games": 185,
      "win_rate": 55.14
    },
    {
      "summ_id": "ggrandfatherr",
      "tier": "SILVER",
      "rank": "IV",
      "wins": 86,
      "losses": 83,
      "total_games": 169,
      "win_rate": 50.89
    },
    {
      "summ_id": "Godstime",
      "tier": "IRON",
      "rank": "II",
      "wins": 8,
      "losses": 8,
      "total_games": 16,
      "win_rate": 50.0
    },
    {
      "summ_id": "Jjice222",
      "tier": "SILVER",
      "rank": "III",
      "wins": 77,
      "losses": 75,
      "total_games": 152,
      "win_rate": 50.66
    },
    {
      "summ_id": "Jueviol",
      "tier": "IRON",
      "rank": "II",
      "wins": 114,
      "losses": 120,
      "total_games": 234,
      "win_rate": 48.72
    },
    {
      "summ_id": "K3 Teedawt",
      "tier": "IRON",
      "rank": "I",
      "wins": 71,
      "losses": 72,
      "total_games": 143,
      "win_rate": 49.65
    },
    {
      "summ_id": "Khanedi ",
      "tier": "SILVER",
      "rank": "IV",
      "wins": 50,
      "losses": 56,
      "total_games": 106,
      "win_rate": 47.17
    },
    {
      "summ_id": "Kingmaker",
      "tier": "GOLD",
      "rank": "IV",
      "wins": 36,
      "losses": 50,
      "total_games": 86,
      "win_rate": 41.86
    },
    {
      "summ_id": "KT PapaChibs",
      "tier": "BRONZE",
      "rank": "III",
      "wins": 12,
      "losses": 12,
      "total_games": 24,
      "win_rate": 50.0
    },
    {
      "summ_id": "KT PapaChiibs ",
      "tier": "BRONZE",
      "rank": "II",
      "wins": 60,
      "losses": 61,
      "total_games": 121,
      "win_rate": 49.59
    },
    {
      "summ_id": "LNK GuyNow",
      "tier": "SILVER",
      "rank": "III",
      "wins": 194,
      "losses": 195,
      "total_games": 389,
      "win_rate": 49.87
    },
    {
      "summ_id": "Lord Loyesco",
      "tier": "GOLD",
      "rank": "I",
      "wins": 309,
      "losses": 282,
      "total_games": 591,
      "win_rate": 52.28
    },
    {
      "summ_id": "LustyKami",
      "tier": "BRONZE",
      "rank": "III",
      "wins": 10,
      "losses": 13,
      "total_games": 23,
      "win_rate": 43.48
    },
    {
      "summ_id": "marvyiscool",
      "tier": "BRONZE",
      "rank": "III",
      "wins": 303,
      "losses": 316,
      "total_games": 619,
      "win_rate": 48.95
    },
    {
      "summ_id": "MenoGrande",
      "tier": "SILVER",
      "rank": "III",
      "wins": 76,
      "losses": 78,
      "total_games": 154,
      "win_rate": 49.35
    },
    {
      "summ_id": "Monteng",
      "tier": "PLATINUM",
      "rank": "IV",
      "wins": 235,
      "losses": 226,
      "total_games": 461,
      "win_rate": 50.98
    },
    {
      "summ_id": "nawtydog",
      "tier": "SILVER",
      "rank": "II",
      "wins": 93,
      "losses": 96,
      "total_games": 189,
      "win_rate": 49.21
    },
    {
      "summ_id": "Nigerian King",
      "tier": "GOLD",
      "rank": "III",
      "wins": 52,
      "losses": 31,
      "total_games": 83,
      "win_rate": 62.65
    },
    {
      "summ_id": "Nigerian Lotus",
      "tier": "BRONZE",
      "rank": "III",
      "wins": 44,
      "losses": 39,
      "total_games": 83,
      "win_rate": 53.01
    },
    {
      "summ_id": "NigerianFaker",
      "tier": "PLATINUM",
      "rank": "IV",
      "wins": 77,
      "losses": 76,
      "total_games": 153,
      "win_rate": 50.33
    },
    {
      "summ_id": "novas3nsei",
      "tier": "PLATINUM",
      "rank": "III",
      "wins": 99,
      "losses": 104,
      "total_games": 203,
      "win_rate": 48.77
    },
    {
      "summ_id": "OTPStormbringer",
      "tier": "GOLD",
      "rank": "IV",
      "wins": 365,
      "losses": 353,
      "total_games": 718,
      "win_rate": 50.84
    },
    {
      "summ_id": "Rahzzcal",
      "tier": "SILVER",
      "rank": "II",
      "wins": 187,
      "losses": 198,
      "total_games": 385,
      "win_rate": 48.57
    },
    {
      "summ_id": "rileybash",
      "tier": "GOLD",
      "rank": "IV",
      "wins": 22,
      "losses": 16,
      "total_games": 38,
      "win_rate": 57.89
    },
    {
      "summ_id": "Sadme17",
      "tier": "GOLD",
      "rank": "IV",
      "wins": 77,
      "losses": 73,
      "total_games": 150,
      "win_rate": 51.33
    },
    {
      "summ_id": "Shegz",
      "tier": "PLATINUM",
      "rank": "IV",
      "wins": 72,
      "losses": 95,
      "total_games": 167,
      "win_rate": 43.11
    },
    {
      "summ_id": "SLY LOKi",
      "tier": "SILVER",
      "rank": "IV",
      "wins": 200,
      "losses": 188,
      "total_games": 388,
      "win_rate": 51.55
    },
    {
      "summ_id": "SRM Kanedi",
      "tier": "BRONZE",
      "rank": "I",
      "wins": 38,
      "losses": 38,
      "total_games": 76,
      "win_rate": 50.0
    },
    {
      "summ_id": "SRM Silverfangs",
      "tier": "PLATINUM",
      "rank": "II",
      "wins": 1,
      "losses": 8,
      "total_games": 9,
      "win_rate": 11.11
    },
    {
      "summ_id": "TE PrismoO",
      "tier": "SILVER",
      "rank": "I",
      "wins": 72,
      "losses": 79,
      "total_games": 151,
      "win_rate": 47.68
    },
    {
      "summ_id": "TE XxRuina",
      "tier": "GOLD",
      "rank": "III",
      "wins": 24,
      "losses": 32,
      "total_games": 56,
      "win_rate": 42.86
    },
    {
      "summ_id": "TheStarOfMorning",
      "tier": "EMERALD",
      "rank": "I",
      "wins": 28,
      "losses": 34,
      "total_games": 62,
      "win_rate": 45.16
    },
    {
      "summ_id": "TK friendly",
      "tier": "GOLD",
      "rank": "III",
      "wins": 245,
      "losses": 228,
      "total_games": 473,
      "win_rate": 51.8
    },
    {
      "summ_id": "TK HYDRA",
      "tier": "BRONZE",
      "rank": "IV",
      "wins": 214,
      "losses": 225,
      "total_games": 439,
      "win_rate": 48.75
    },
    {
      "summ_id": "TK NigerianPluto",
      "tier": "GOLD",
      "rank": "IV",
      "wins": 298,
      "losses": 288,
      "total_games": 586,
      "win_rate": 50.85
    },
    {
      "summ_id": "TK SavageMummy",
      "tier": "GOLD",
      "rank": "I",
      "wins": 411,
      "losses": 392,
      "total_games": 803,
      "win_rate": 51.18
    },
    {
      "summ_id": "Versatile",
      "tier": "GOLD",
      "rank": "III",
      "wins": 108,
      "losses": 94,
      "total_games": 202,
      "win_rate": 53.47
    },
    {
      "summ_id": "Villanelle",
      "tier": "GOLD",
      "rank": "IV",
      "wins": 120,
      "losses": 105,
      "total_games": 225,
      "win_rate": 53.33
    },
    {
      "summ_id": "Zanbacto",
      "tier": "GOLD",
      "rank": "IV",
      "wins": 157,
      "losses": 157,
      "total_games": 314,
      "win_rate": 50.0
    }
  ]
}